{
  "$schema": "https://json-schema.org/draft/2020-12/schema",
  "type": "object",
  "properties": {
    "name": {
      "type": "string",
      "minLength": 1
    },
    "role": {
      "type": "string",
      "minLength": 1
    },
    "bio": {
      "type": "string",
      "minLength": 1
    },
    "photoUrl": {
      "type": "string",
      "maxLength": 2048,
      "format": "uri",
      "pattern": "^https?://"
    },
    "twitter": {
      "type": "string",
      "maxLength": 2048,
      "format": "uri",
      "pattern": "^https?://"
    },
    "bluesky": {
      "type": "string",
      "maxLength": 2048,
      "format": "uri",
      "pattern": "^https?://"
    },
    "mastodon": {
      "type": "string",
      "maxLength": 2048,
      "format": "uri",
      "pattern": "^https?://"
    },
    "linkedin": {
      "type": "string",
      "maxLength": 2048,
      "format": "uri",
      "pattern": "^https?://"
    },
    "website": {
      "type": "string",
      "maxLength": 2048,
      "format": "uri",
      "pattern": "^https?://"
    }
  },
  "required": [
    "name"
  ],
  "additionalProperties": false
}
