{
  "name": "Julio Carrettoni",
  "bio": "Julio Carrettoni started his professional career in 2009 as an iPhoneOS Developer. Since that time he has developed also for Blackberry (Java and C++) and Android, but his platform of choice has always been iOS. Always working from Buenos Aires Argentina, Julio is also a co host at @NSCoderBA and an active collaborator and former speaker at @NSConfArg. Currently he performs as the VP of mobile applications in Blue Trail Software without ever stopping coding.",
  "photoUrl": "https://www.tryswift.co/assets/images/speakers/nyc2017/speakers/fotopulenta.jpg",
  "twitter": "https://twitter.com/dev_jac"
}
