{
  "name": "Edward Harker",
  "role": "Founder & Mobile Engineer @ BugScreen",
  "bio": "Edward is a software engineer formerly at Deliveroo and Shazam. He is passionate about building high-quality mobile apps with a focus on quality, testing and performance.",
  "photoUrl": "https://cdn.sessionize.com/image/8dd3-400o400o1-fzrHZNnTm2bYxoeeFmgUCb.jpg"
}
