{
  "name": "Matvei Novoselov",
  "role": "iOS and visionOS Software Engineer at Sony Group",
  "bio": "I am an iOS and visionOS Software Engineer working in London, UK at Sony Group. Apple Developer Academy Alumni. Apple Swift Student Challenge 2025 winner. Co-author of a scientific research paper on visionOS and Spatial Computing at the ICSR International Conference on Social Robotics published by Springer. Co-author of Virtual Film Maker Patent SYP361478US01.",
  "photoUrl": "https://do-ios.com/images/speakers/2026/matvei.webp"
}
