{
  "name": "Andra Pop",
  "role": "iOS Developer, Garmin",
  "bio": "Andra has been an iOS developer for 7 years, combining her love for technology and problem solving with a passion for building beautiful, user-friendly apps. Outside of coding, she enjoys travelling to new places and staying active through a variety of sports. She’s excited to present at Swift Heroes to share insights, connect with fellow developers, and explore new ways to push the boundaries of app development.",
  "photoUrl": "https://swiftheroes.com/2025/wp-content/uploads/sites/7/sito_foto_pop-1.png",
  "twitter": "https://x.com/AndraPop29",
  "linkedin": "https://www.linkedin.com/in/andra-pop-66111216b/"
}
