{
  "name": "Marc Nahum",
  "role": "Senior Program Manager - Microsoft",
  "bio": "After studies in Paris, and few years to work there I moved to Switzerland for a large enterprise to manage Active Directory and Citrix Severs.\nIn 2009 with the increase of importance of mobile devices, the need to manage them bring me to this new business for the same company.\n\nAfter selection, implementation, upgrade, modernisation of MDM and remote access solution my road crossed Intune.\nDuring all these years I worked daily, promoted, and made the management of macOS possible. When I joined Microsoft as a PM in the Intune Engineering org it’s naturally that is become my platform of choice",
  "photoUrl": "https://macsysadmin.se/speakers/files/image-2430.png"
}
