{
  "name": "Saúl Díaz",
  "bio": "Saúl Díaz has been developing Android since 2010. Currently he is working on Chicisimo, and Android app selected as one of the best of 2015 on Spain, and featured on Google Play by the Google Play Team. Previously he has worked as Android Lead on Fever and Android Developer on Tuenti, two renowned companies of Spain. He is an active member of the Spanish Android Development community and regularly participates in events and conferences.",
  "photoUrl": "http://2017.mobilization.pl/images/speakers/saul-diaz.jpg",
  "twitter": "https://twitter.com/@sefford",
  "linkedin": "https://www.linkedin.com/in/sefford/"
}
