{
  "name": "Jacek Rondio",
  "role": "Software engineer at HARMAN Connected Services",
  "bio": "A software engineer currently working at HARMAN Connected Services mainly focused on Android applications development, however not afraid of deeper layers of the system. Passionate about mobile and technology as well as understanding his 2 y.o. son",
  "photoUrl": "http://2019.mobilization.pl/assets/images/speakers/jacek-rondio.png"
}
