{
  "name": "Curtis Colly",
  "role": "Indie Web and iOS Developer",
  "bio": "Curtis Colly is self-employed as a full-stack web application and iOS developer. Having built a variety of consumer oriented web apps in a myriad of web languages, he appreciates the safety and efficiency that the statically typed Swift offers. He strives to make his code functional, durable and scalable. Curtis enjoys seeking hidden truths. As a result, he appreciates good conversations, experiencing difference cultures and testing innovative ideas in the real-world. He is currently working on a video app for people to share meaningful thoughts on various topics.",
  "photoUrl": "https://www.tryswift.co/assets/images/speakers/nyc2020/curtis.jpg",
  "twitter": "https://twitter.com/curtiscolly"
}
