{
  "name": "Miriam Friedel",
  "role": "Head of Data Science, Skafos.ai",
  "bio": "Dr. Miriam Friedel has spent over fifteen years in scientific and technical fields spanning theoretical physics, software engineering, transportation, neuroscience, and machine learning. She currently leads the data science team at Skafos, a start up in Charlottesville, VA. Skafos.ai is the ML platform for iOS developers, offering push-button deployment to the edge. Prior to her current role, Miriam was a Director and Senior Scientist at Elder Research, where she lead the commercial business unit and helped clients in a range of industries achieve ROI from machine learning. Her unique background helps her bridge the gap from technical details to strategic insights, increasing collaboration across disparate functional teams. Miriam received her ScB in physics from Brown University and her PhD in Physics from the University of California, Santa Barbara. She is a co-author on over fifteen peer reviewed articles, and outside of work, spends as much time as possible practicing yoga and being with her two daughters.",
  "linkedin": "https://www.linkedin.com/in/miriam-friedel-aa2b0611/",
  "website": "https://skafos.ai"
}
